query,title,url,snippet
manual,Fresha Malta Spa Treatments,https://www.fresha.com/lp/en/tt/spa-treatments/in/mt-malta,Malta spa treatment listings with venue names prices and reviews
manual,Fresha Malta Spa Packages,https://www.fresha.com/lp/en/tt/spa-packages/in/mt-malta,Malta spa package listings with prices and reviews
manual,Fresha Malta Full Body Massage,https://www.fresha.com/lp/en/tt/full-body-massages/in/mt-malta,Malta massage listing with venues prices and reviews
manual,Tripadvisor Malta Spas,https://www.tripadvisor.com/Attractions-g190311-Activities-c40-Malta.html,Malta spas and wellness centers ranking
manual,Tripadvisor Island of Malta Spas,https://www.tripadvisor.com/Attractions-g190320-Activities-c40-Island_of_Malta.html,Island of Malta spa ranking
manual,Tripadvisor Saint Julians Spas,https://www.tripadvisor.com/Attractions-g227101-Activities-c40-Saint_Julian_s_Island_of_Malta.html,Saint Julians spa ranking
manual,Tripadvisor St Pauls Bay Spas,https://www.tripadvisor.com/Attractions-g608946-Activities-c40-St_Paul_s_Bay_Island_of_Malta.html,St Pauls Bay spa ranking
manual,Carisma Locations,https://www.carismaspa.com/carisma-spa-locations-in-malta,Official Carisma location list
manual,Carisma Main,https://www.carismaspa.com/,Official Carisma main page
manual,Carisma Massages,https://www.carismaspa.com/massages,Official massage pricing page
manual,Carisma Spa Day,https://www.carismaspa.com/spa-day,Official spa day pricing page
manual,Myoka Locations,https://myoka.com/locations,Official Myoka location list
manual,Myoka Contact,https://myoka.com/contact-us,Official Myoka contact/location page
manual,Myoka Hilton Malta,https://myoka.com/fivesenses,Official Hilton Malta outlet page
manual,Myoka Malta Marriott,https://myoka.com/lotus,Official Malta Marriott outlet page
manual,Myoka DoubleTree,https://myoka.com/doubletree,Official DoubleTree outlet page
manual,Phoenicia Treatments,https://phoeniciamalta.com/spa-wellness/spa-treatments/,Official treatment menu with prices
manual,Iniala Spa,https://inialamalta.com/spa/,Luxury spa outlet page
