input_id,cost_component,linked_dataset_id,input_group,input_name,selected_input_basis,selected_value,value_unit,selected_value_low,selected_value_mid,selected_value_high,input_status,modeling_position,use_case,source_reference,decision_reference,adjustment_logic_note,caveat_note,next_action
COST_001,minimum_wage_floor,SRC_001,labor_floor,Malta minimum wage 2026,official_statutory_floor,229.44,EUR per week,,229.44,,verified_ready,hard_floor,Legal minimum labor floor anchor,malta_minimum_wage_2026_source_snapshot.csv,,Use as non-negotiable statutory wage floor before any therapist salary uplift.,Do not confuse with COLA-adjusted employee-received figure shown separately on source page.,Use directly in labor cost build.
COST_002,employer_ssc,SRC_002,labor_burden,Employer social security contribution 2026,official_statutory_payroll_burden,10% / 22.94 weekly reference / 49.04 cap,percent and weekly capped logic,10%,22.94,49.04,verified_ready,statutory_burden_layer,Employer payroll burden input,malta_employer_ssc_2026_source_snapshot.csv,,Preserve wage-band and worker-category treatment in later payroll formulas.,Do not flatten into one number without documenting category logic.,Translate into payroll formula layer later.
COST_003,vat_rate,SRC_003,tax_layer,Malta VAT rate,official_standard_vat_rate,18,percent,,18,,verified_ready,default_tax_layer,Default menu price incl/excl VAT conversion,malta_vat_rate_source_snapshot.csv,,Use standard VAT unless a reduced/exempt treatment is specifically validated for exact service class.,Do not assume reduced treatment without explicit service mapping evidence.,Use directly in pricing conversion logic.
COST_004,therapist_salary_anchor,SRC_004,salary_benchmark,Therapist / beautician salary benchmark,provisionally_accepted_upper_market_anchor,30000,EUR per year,18291,30000,,draft_ready_not_final,upper_market_anchor,Draft therapist compensation calibration above legal floor,malta_therapist_salary_benchmark_source_snapshot.csv,pricing_benchmark_verification_decision.csv:BDEC_001,"Treat EUR 30,000/year as upper live-market anchor; use EUR 18,291/year as secondary comparator band support.",Role adjacency risk remains because source is beautician/beauty therapist rather than pure spa therapist.,Look for spa therapist / massage therapist Malta evidence before finalizing.
COST_005,commercial_rent_anchor,SRC_006,rent_benchmark,Commercial rent / occupancy benchmark,provisionally_accepted_listing_derived_band,10-14,EUR per sqm per month,10,12,14,draft_ready_not_final,mid_market_anchor,Draft fixed-overhead location cost anchor,malta_commercial_rent_benchmark_source_snapshot.csv,pricing_benchmark_verification_decision.csv:BDEC_002,Use 10-14 as draft mid-market anchor; treat 20-22 as premium stress band outside base case.,Listing-derived evidence is not yet filtered specifically for spa-suitable premises.,Capture more spa-suitable comparables before finalizing occupancy assumption.
